{
  "schemaVersion": 1,
  "catalogVersion": "0.5.0",
  "source": "Existing recipes from plan_alimentacion_dinamico_3_semanas.html plus 23 curated recipes using foods from catalogVersion 0.2.0.",
  "status": "Catálogo de recetas genéricas con cantidades base; la app adapta las raciones al perfil y a la actividad real registrada por fecha.",
  "recipes": [
    {
      "id": "yogur_platano",
      "name": "Yogur con granola y plátano",
      "mealType": "desayuno",
      "baseServings": 1,
      "timeMinutes": 5,
      "photoKey": "yogurt",
      "ingredients": [
        {
          "foodId": "skyr",
          "amount": 250,
          "unit": "g"
        },
        {
          "foodId": "granola",
          "amount": 30,
          "unit": "g"
        },
        {
          "foodId": "banana",
          "amount": 120,
          "unit": "g"
        },
        {
          "foodId": "milk",
          "amount": 120,
          "unit": "ml"
        },
        {
          "foodId": "coffee",
          "amount": 7,
          "unit": "g"
        }
      ],
      "steps": [
        "Sirve el yogur natural en un bol.",
        "Corta el plátano en rodajas y añádelo.",
        "Termina con la granola justo antes de comer para que quede crujiente.",
        "Prepara el café con la leche indicada."
      ],
      "tip": "Puedes repetir este desayuno cambiando la fruta. No incluye queso.",
      "description": ""
    },
    {
      "id": "tostada_queso",
      "name": "Tostada de queso fresco y tomate",
      "mealType": "media",
      "baseServings": 1,
      "timeMinutes": 5,
      "photoKey": "toast",
      "ingredients": [
        {
          "foodId": "bread",
          "amount": 60,
          "unit": "g"
        },
        {
          "foodId": "cheese",
          "amount": 80,
          "unit": "g"
        },
        {
          "foodId": "tomato",
          "amount": 100,
          "unit": "g"
        },
        {
          "foodId": "mandarin",
          "amount": 100,
          "unit": "g"
        }
      ],
      "steps": [
        "Tuesta el pan.",
        "Añade el tomate rallado o en rodajas y el queso fresco.",
        "Acompaña con una mandarina."
      ],
      "tip": "El queso solo aparece como snack o en comidas/cenas, nunca en el desayuno.",
      "description": ""
    },
    {
      "id": "arroz_pollo",
      "name": "Arroz con pollo y verduras",
      "mealType": "comida",
      "baseServings": 1,
      "timeMinutes": 25,
      "photoKey": "rice",
      "ingredients": [
        {
          "foodId": "rice",
          "amount": 65,
          "unit": "g"
        },
        {
          "foodId": "chicken",
          "amount": 160,
          "unit": "g"
        },
        {
          "foodId": "pepper",
          "amount": 80,
          "unit": "g"
        },
        {
          "foodId": "zucchini",
          "amount": 100,
          "unit": "g"
        },
        {
          "foodId": "onion",
          "amount": 70,
          "unit": "g"
        },
        {
          "foodId": "oliveoil",
          "amount": 10,
          "unit": "g"
        }
      ],
      "steps": [
        "Cuece el arroz en agua siguiendo el tiempo indicado por el fabricante.",
        "Corta pimiento, calabacín y cebolla en trozos pequeños.",
        "Saltea las verduras con el aceite durante 6–8 minutos.",
        "Añade el pollo en tiras, pimentón y ajo; cocínalo por completo.",
        "Mezcla con el arroz y ajusta la sal y pimienta."
      ],
      "tip": "Prepara dos raciones de verduras para aprovechar en otra receta. Enfría el arroz cocido con rapidez si lo guardas.",
      "description": ""
    },
    {
      "id": "yogur_nueces",
      "name": "Yogur alto en proteínas con nueces",
      "mealType": "tarde",
      "baseServings": 1,
      "timeMinutes": 2,
      "photoKey": "yogurt",
      "ingredients": [
        {
          "foodId": "skyr",
          "amount": 170,
          "unit": "g"
        },
        {
          "foodId": "walnuts",
          "amount": 15,
          "unit": "g"
        }
      ],
      "steps": [
        "Sirve el yogur en un cuenco.",
        "Trocea ligeramente las nueces y mézclalas."
      ],
      "tip": "Una merienda muy rápida con proteínas y grasas saludables.",
      "description": ""
    },
    {
      "id": "merluza_patatas",
      "name": "Merluza con patata y judías verdes",
      "mealType": "cena",
      "baseServings": 1,
      "timeMinutes": 22,
      "photoKey": "hake",
      "ingredients": [
        {
          "foodId": "hake",
          "amount": 180,
          "unit": "g"
        },
        {
          "foodId": "potato",
          "amount": 200,
          "unit": "g"
        },
        {
          "foodId": "greenbeans",
          "amount": 250,
          "unit": "g"
        },
        {
          "foodId": "oliveoil",
          "amount": 10,
          "unit": "g"
        }
      ],
      "steps": [
        "Lava y corta la patata en dados y cocínala tapada en el microondas unos 7–9 minutos.",
        "Sazona la merluza con ajo, pimienta y limón.",
        "Cocínala en freidora de aire a 180 °C aproximadamente 10–12 minutos, según grosor.",
        "Cuece o cocina las judías verdes al vapor.",
        "Sirve con el aceite de oliva repartido entre patatas y verduras."
      ],
      "tip": "Comprueba que el pescado esté bien hecho y ajusta el tiempo a tu aparato.",
      "description": ""
    },
    {
      "id": "huevos_pan_kiwi",
      "name": "Huevos revueltos, tostadas y kiwi",
      "mealType": "desayuno",
      "baseServings": 1,
      "timeMinutes": 12,
      "photoKey": "egg",
      "ingredients": [
        {
          "foodId": "eggs",
          "amount": 2,
          "unit": "ud"
        },
        {
          "foodId": "bread",
          "amount": 70,
          "unit": "g"
        },
        {
          "foodId": "tomato",
          "amount": 100,
          "unit": "g"
        },
        {
          "foodId": "kiwi",
          "amount": 85,
          "unit": "g"
        },
        {
          "foodId": "milk",
          "amount": 120,
          "unit": "ml"
        },
        {
          "foodId": "coffee",
          "amount": 7,
          "unit": "g"
        }
      ],
      "steps": [
        "Bate los huevos y cuájalos a fuego bajo en una sartén antiadherente.",
        "Tuesta el pan y acompaña con tomate en rodajas.",
        "Pela el kiwi y prepara el café con leche."
      ],
      "tip": "No hace falta añadir queso al desayuno. Puedes cambiar el revuelto por tortilla francesa.",
      "description": ""
    },
    {
      "id": "yogur_manzana",
      "name": "Yogur con manzana",
      "mealType": "media",
      "baseServings": 1,
      "timeMinutes": 3,
      "photoKey": "yogurt",
      "ingredients": [
        {
          "foodId": "skyr",
          "amount": 170,
          "unit": "g"
        },
        {
          "foodId": "apple",
          "amount": 180,
          "unit": "g"
        }
      ],
      "steps": [
        "Lava la manzana y córtala en trozos.",
        "Mézclala con el yogur natural, o tómala por separado."
      ],
      "tip": "Añade canela si te apetece.",
      "description": ""
    },
    {
      "id": "lentejas_huevo",
      "name": "Lentejas templadas con huevo",
      "mealType": "comida",
      "baseServings": 1,
      "timeMinutes": 20,
      "photoKey": "lentil",
      "ingredients": [
        {
          "foodId": "lentils",
          "amount": 220,
          "unit": "g"
        },
        {
          "foodId": "eggs",
          "amount": 1,
          "unit": "ud"
        },
        {
          "foodId": "cheese",
          "amount": 80,
          "unit": "g"
        },
        {
          "foodId": "pepper",
          "amount": 70,
          "unit": "g"
        },
        {
          "foodId": "onion",
          "amount": 50,
          "unit": "g"
        },
        {
          "foodId": "carrot",
          "amount": 80,
          "unit": "g"
        },
        {
          "foodId": "bread",
          "amount": 20,
          "unit": "g"
        },
        {
          "foodId": "oliveoil",
          "amount": 10,
          "unit": "g"
        }
      ],
      "steps": [
        "Cuece el huevo en agua durante unos 10 minutos y enfríalo.",
        "Enjuaga y escurre las lentejas del bote.",
        "Pica zanahoria, cebolla y pimiento, y saltéalos 7–8 minutos con el aceite.",
        "Incorpora las lentejas y calienta 3 minutos.",
        "Sirve con el huevo cortado, el queso fresco y un poco de pan."
      ],
      "tip": "Conserva las legumbres en un recipiente adecuado tras abrir el bote, sin dejarlas varios días en la lata.",
      "description": ""
    },
    {
      "id": "hummus_zanahoria",
      "name": "Hummus con zanahoria y pan",
      "mealType": "tarde",
      "baseServings": 1,
      "timeMinutes": 5,
      "photoKey": "chickpea",
      "ingredients": [
        {
          "foodId": "hummus",
          "amount": 50,
          "unit": "g"
        },
        {
          "foodId": "carrot",
          "amount": 100,
          "unit": "g"
        },
        {
          "foodId": "bread",
          "amount": 40,
          "unit": "g"
        }
      ],
      "steps": [
        "Pela la zanahoria y córtala en bastones.",
        "Sirve el hummus en un cuenco y acompaña con zanahoria y pan integral."
      ],
      "tip": "Una buena opción de snack saciante.",
      "description": ""
    },
    {
      "id": "pasta_pavo",
      "name": "Pasta integral con pavo y calabacín",
      "mealType": "cena",
      "baseServings": 1,
      "timeMinutes": 20,
      "photoKey": "pasta",
      "ingredients": [
        {
          "foodId": "pasta",
          "amount": 65,
          "unit": "g"
        },
        {
          "foodId": "turkey",
          "amount": 160,
          "unit": "g"
        },
        {
          "foodId": "tomatoSauce",
          "amount": 150,
          "unit": "g"
        },
        {